conceptType,conceptUri,preferredLabel,status,altLabels,description,broaderConceptUri,broaderConceptPT
Occupation,http://data.europa.eu/esco/occupation/9851c83c-5670-4da0-964a-1ef0e682e30b,thanatology researcher,released,thanatologist | researcher in the psychology of death and dying | thanatological researcher | researcher in thanatology | fellow in thanatology | thanatological scholar,"Thanatology researchers study death and the dying in a variety of scientific fields such as psychology, sociology, physiology and anthropology. They contribute to the growth of knowledge on aspects of death such as the psychological phenomena the dying and those around them are experiencing.",http://data.europa.eu/esco/isco/C2632,"Sociologists, anthropologists and related professionals"
Occupation,http://data.europa.eu/esco/occupation/9905cc76-d48b-49b1-94ab-17becb30be1a,food science lecturer,released,professor of food science and nutrition | food sciences professor | university lecturer in food science | professor of food science | university food sciences teacher | food sciences teacher | food science professor | food science teacher | food sciences instructor | higher education food sciences teacher | food science docent | lecturer in food science | university food science lecturer | food science and nutrition lecturer | food science instructor | lecturer in food science and nutrition | food science lector | food sciences lector | food sciences docent,"Food science lecturers are subject professors, teachers, or lecturers who instruct students who have obtained an upper secondary education diploma in their own specialised field of study, food science, which is predominantly academic in nature. They work with their university research assistants and university teaching assistants for the preparation of lectures and of exams, grading papers and exams and leading review and feedback sessions for the students. They also conduct academic research in their field of food science, publish their findings and liaise with other university colleagues.",http://data.europa.eu/esco/occupation/684fd8d5-9b40-4b02-a680-438f0082d923,higher education lecturer
Occupation,http://data.europa.eu/esco/occupation/99492920-e5a5-4dba-9e5a-93193147198c,economist,released,econophysicist | economics scholar | economics scientist | economics researcher | econometrician | economics research analyst | interest analyst | economics research scientist | macro analyst | economics science researcher | social economist | labour economist | economics analyst,"Economists perform research and develop theories in the field of economics, whether for microeconomic or macroeconomic analysis. They study trends, analyse statistical data, and to some extent work with economic mathematical models in order to advise companies, governments, and related institutions. They advise on product feasibility, trend forecasts, emerging markets, tax policies, and consumer trends.",http://data.europa.eu/esco/isco/C2631,Economists
Occupation,http://data.europa.eu/esco/occupation/9a7e780a-b778-4a5a-b4eb-309d394d313d,university literature lecturer,released,literature teacher | literature instructor | literature professor | senior lecturer in literature | university literature professor | lecturer of literature | literature lector | literature docent | higher education literature lecturer | HE literature teacher | higher education literature teacher | professor of literature | university lecturer in literature | lecturer in literature | literature lecturer | HE literature lecturer,"University literature lecturers are subject professors, teachers, or lecturers who instruct students who have obtained an upper secondary education diploma in their own specialised field of study, literature, which is predominantly academic in nature. They work with their university research assistants and university teaching assistants in the preparation of lectures and of exams, in grading papers and exams and in leading review and feedback sessions for the students. They also conduct academic research in their respective field of literature, publish their findings and liaise with other university colleagues.",http://data.europa.eu/esco/occupation/684fd8d5-9b40-4b02-a680-438f0082d923,higher education lecturer
Occupation,http://data.europa.eu/esco/occupation/9b889f07-c39c-464d-b9d9-b2daa650f9ac,specialised doctor,released,specialized medical doctor | specialized doctor | hospital specialized doctor | specialised medical doctor | hospital specialised doctor,"Specialised doctors prevent, diagnose and treat diseases depending on their medical or surgical specialty.",http://data.europa.eu/esco/isco/C2212,Specialist medical practitioners
Occupation,http://data.europa.eu/esco/occupation/a36c14e6-ed96-467d-8390-6f9cf47ac350,history lecturer,released,history teacher | lecturer of history | history instructor | professor of modern history | lecturer in history | history lector | professor of history | modern history lecturer | university history teacher | history docent | university lecturer in history | professor of ancient history | professor of medieval history | history professor | ancient history lecturer | university history lecturer | higher education history teacher | medieval history lecturer,"History lecturers are subject professors, teachers, or lecturers who instruct students who have obtained an upper secondary education diploma in their own specialised field of study, history, which is predominantly academic in nature. They work with their university research assistants and university teaching assistants for the preparation of lectures and of exams, for grading papers and exams and for leading review and feedback sessions for the students. They also conduct academic research in their respective field of history, publish their findings and liaise with other university colleagues.",http://data.europa.eu/esco/occupation/684fd8d5-9b40-4b02-a680-438f0082d923,higher education lecturer
Occupation,http://data.europa.eu/esco/occupation/a63733fa-f7ff-4733-8961-1ec4eeaab00b,museum scientist,released,conservationist scientist | museum researcher | museum administrator,"Museum scientists perform and/or manage the curatorial, preparatory and clerical work in general museums, botanical gardens, art galleries, fine arts related collections, aquariums or similar areas. They manage the collections of natural, historical and anthropological material that is educational, scientific or aesthetic in purpose.",http://data.europa.eu/esco/isco/C2621,Archivists and curators
Occupation,http://data.europa.eu/esco/occupation/a7a74a05-3dd0-46c6-99af-92df8042520c,microbiologist,released,virologist | microbiology research analyst | histologist | bacteriologist | microbiology studies research analyst | microbiology researcher | microbiology studies scientist | microbiology science researcher | microbiology scholar | microbiology studies analyst | helminthologist | microbiology studies researcher | microbiology biotechnologist | microbiology studies scholar | parasitologist | microbiology scientist | microbiology analyst | microbiology studies research scientist | microbiology research scientist,"Microbiologists study and research the life forms, characteristics, and processes of microscopic organisms. They study microorganisms such as bacteria, protozoa, fungi, etc. in order to diagnose and counteract the effects that these microorganisms might have in animals, in the environment, in the food industry, or in the health care industry.",http://data.europa.eu/esco/occupation/eee68e13-8248-43bb-a9fb-959832a6c217,biologist
Occupation,http://data.europa.eu/esco/occupation/a9c7a04d-807a-41b5-b441-87c73c73c9c5,linguist,released,americanist | latinist | linguists | linguistic research scientist | slavist | linguistic scholar | tibetologist | africanist | linguistic researcher | germanist | arabist | anglist | japanologist | scandinavist | semitist | sinologist | hellenist | romanist | philologist | computational linguist | terminologist | koreanist | linguistic science researcher | linguistic scientist | baltist | phonetics specialist | indologist,"Linguists study languages scientifically. They master languages and can interpret them in terms of their grammatical, semantic, and phonetic characteristics. They research the evolution of language and the way it is used by societies.",http://data.europa.eu/esco/isco/C2643,"Translators, interpreters and other linguists"
Occupation,http://data.europa.eu/esco/occupation/ab360abd-32e2-4e03-967d-a10758efffa7,mechatronics engineer,released,electromechanical engineer | robotics engineer | specialist mechatronic engineer | cybernetics engineer | engineer in mechatronics | engineer of mechatronics | advanced mechatronics engineer | mechatronic engineering specialist | mechanical systems engineer | mechatronics systems designer,"Mechatronics engineers design and develop intelligent systems, such as robotic devices, smart home appliances, and aeroplanes, through combining technologies from mechanical, electronic, computer, and control engineering. They create blueprints or design documents for parts, assemblies or finished products using software programs, and also oversee and manage projects.",http://data.europa.eu/esco/occupation/579254cf-6d69-4889-9000-9c79dc568644,mechanical engineer
Occupation,http://data.europa.eu/esco/occupation/ab3c4d3e-3189-47ad-82af-57cdae3cb589,optical engineer,released,optics engineer | optical technology engineer | optical engineering specialist | optical engineering expert | optical technology engineering expert | optical technology engineering specialist | optical engineering adviser | optical engineering consultant | optic engineer | optical technology engineering adviser | optical technology engineering consultant,"Optical engineers design and develop different industrial applications with optics. They have knowledge of light, light transmission principles, and optics in order to design engineering specs of equipment such as microscopes, lenses, telescopes, and other optical devices.",http://data.europa.eu/esco/isco/C2149,Engineering professionals not elsewhere classified
Occupation,http://data.europa.eu/esco/occupation/ac8b3cd1-a127-4e6a-8208-5cfcf7111955,statistician,released,statistic research scientist | statistics research scientist | statistics specialist | statistical scientist | statistics scientist | statistics research analyst | statistical data analyst | statistic research associate | statistical research scientist | statistics researcher | statistics scholar | statistics science researcher | statistics analyst | senior statistician | statistical science researcher | statistical researcher | statisticians | statistical research analyst | statistical scholar,"Statisticians collect, tabulate, and, most importantly, analyse quantitative information coming from a varied array of fields. They interpret and analyse statistical studies on fields such as health, demographics, finance, business, etc. and advise based on patterns and drawn analysis.",http://data.europa.eu/esco/isco/C2120,"Mathematicians, actuaries and statisticians"
Occupation,http://data.europa.eu/esco/occupation/acf69cab-8629-45c8-ae10-c8fb15f474b6,anthropologist,released,arts scientist | cultural scientist | linguistic anthropologist | ethnologist | television scientist | music scientist | sociocultural anthropologist | anthropology research scientist | biological anthropologist | social anthropologist | cultural anthropologist | gender scientist | anthropologue | art sciences scientist | theatre scientist | musicology scientist | movie scientist | archaeological anthropologist | forensic anthropologist,"Anthropologists research all aspects of life pertaining to humans. They study the various civilisations that have existed along the time and their ways of organisation. They attempt to analyse the physical, societal, linguistic, political, economical, philosophical, and cultural aspects of different people. The aim of their studies is to understand and describe the past of humanity and solve topical societal problems. They explore different perspectives such as philosophical anthropology.",http://data.europa.eu/esco/isco/C2632,"Sociologists, anthropologists and related professionals"
Occupation,http://data.europa.eu/esco/occupation/ae2c1bf4-669e-4fec-a7d7-698753699083,philosophy lecturer,released,senior lecturer in philosophy | higher education philosophy teacher | philosophy docent | philosophy instructor | lector of philosophy | philosophy lector | professor of philosophy | philosophy professor | university philosophy teacher | philosophy teacher | lecturer of philosophy | lecturer in philosophy | university philosophy lecturer | university lecturer in philosophy,"Philosophy lecturers are subject professors, teachers, or lecturers who instruct students who have obtained an upper secondary education diploma in their own specialised field of study, philosophy, which is predominantly academic in nature. They work with their university research assistants and university teaching assistants for the preparation of lectures and of exams, for grading papers and exams and for leading review and feedback sessions for the students. They also conduct academic research in their respective field of philosophy, publish their findings and liaise with other university colleagues.",http://data.europa.eu/esco/occupation/684fd8d5-9b40-4b02-a680-438f0082d923,higher education lecturer
Occupation,http://data.europa.eu/esco/occupation/ae8b19cc-8c6e-4a16-ada2-c15f97ded133,optomechanical engineer,released,opto-mechanics engineer | opto-mechanical engineer | optomechanical engineering expert | optomechanical design engineer | optomechanical engineering adviser | optomechanical engineering specialist | engineer in optomechanical design | engineer of optomechanical systems | optomechanical technology engineer | engineer in optical systems | optomechanical manufacturing engineer | engineer in optomechanical systems | optomechanical technology engineering adviser | optomechanical engineering consultant | optomechanical technology engineering specialist | optomechanical technology engineering expert | optomechanical technology engineering consultant,"Optomechanical engineers design and develop optomechanical systems, devices, and components, such as optical mirrors and optical mounts. Optomechanical engineering combines optical engineering with mechanical engineering in the design of these systems and devices. They conduct research, perform analysis, test the devices, and supervise the research.",http://data.europa.eu/esco/occupation/579254cf-6d69-4889-9000-9c79dc568644,mechanical engineer
Occupation,http://data.europa.eu/esco/occupation/b0f3f595-4965-4f13-ba5c-f6049b62469f,biometrician,released,biometrics scientist | biometricians | biometric studies scholar | biometrics analyst | biometrics researcher | biometric studies research analyst | biometric studies scientist | biometric studies analyst | biometrics scholar | biometrics research analyst | biometrics research scientist | biometrics science researcher | biometric studies research scientist | biometric studies researcher,"Biometricians perform research in the field of biometrics. They carry statistical or biological research projects by measuring fingerprints, retinas, and human shapes for medical or industrial applications.",http://data.europa.eu/esco/occupation/ac8b3cd1-a127-4e6a-8208-5cfcf7111955,statistician
Occupation,http://data.europa.eu/esco/occupation/b2cede50-82bb-4684-9f11-1930e12ad672,energy engineer,released,energies engineer | energy technology engineering specialist | energy technology engineering expert | power engineer | energy technology engineering consultant | energy engineering specialist | energy engineering consultant | energy technology engineer | energy engineering researcher | energy technology engineering adviser | energy engineering expert | energy efficiency engineer | energy engineering adviser,"Energy engineers design new, efficient and clean ways to produce, transform, and distribute energy to improve environmental sustainability and energy efficiency. They deal with the extraction of energy through natural resources, such as oil or gas, or renewable and sustainable sources, such as wind or solar power.",http://data.europa.eu/esco/isco/C2149,Engineering professionals not elsewhere classified
Occupation,http://data.europa.eu/esco/occupation/b3ebf55f-5e50-4262-946a-f08d7fbe29b2,healthcare specialist lecturer,released,nursing specialist instructor | orthopaedics instructor | lecturer in specialized healthcare | embryology professor | paediatrics docent | healthcare specialist instructor | dietetics teacher | orthopaedics lecturer | embryology teacher | specialist lecturer in healthcare science | pathology instructor | lecturer of specialized healthcare | paediatrics teacher | geriatrics docent | orthopaedics teacher | healthcare specialist professor | healthcare lector | paediatrics lecturer | pedagogy lecturer | pathology professor | nursing specialist docent | dietetics docent | dietetics professor | oncology lecturer | lecturer of specialised healthcare | healthcare specialist teacher | healthcare specialist docent | geriatrics instructor | healthcare specialist lector | pathology lecturer | embryology instructor | pathology teacher | nursing specialist teacher | specialist nursing lecturer | geriatrics professor | geriatrics lecturer | dietetics lecturer | dietetics instructor | paediatrics professor | embryology docent | university healthcare science lecturer | lecturer in specialist healthcare science | orthopaedics docent | nursing specialist professor | orthopaedics professor | nursing specialist lecturer | university lecturer in healthcare science | lecturer in specialised healthcare | paediatrics instructor | embryology lecturer | geriatrics teacher | pathology docent,"Healthcare specialist lecturers are subject professors, teachers, or lecturers, and often doctors who instruct students who have obtained an upper secondary education diploma in their own specialised field of healthcare, which is predominantly academic in nature. They work with their university research assistants and university teaching assistants for the preparation of lectures and of exams, for grading papers and exams, for leading laboratory practices, and for leading review and feedback sessions for the students. They also conduct academic research in their respective field of specialist healthcare, publish their findings and liaise with other university colleagues.",http://data.europa.eu/esco/occupation/684fd8d5-9b40-4b02-a680-438f0082d923,higher education lecturer
Occupation,http://data.europa.eu/esco/occupation/b5d1912e-89c7-4a66-ab96-0dc5f4f6c426,immunologist,released,immunology analyst | immunology researcher | immunology studies research analyst | immunology research analyst | immunology studies researcher | immunology studies scientist | immunology scientist | immunology studies scholar | immunologists | immunology science researcher | immunology studies analyst | immunology studies research scientist | immunology research scientist | immunology scholar,"Immunologists research the immune system of living organisms (e.g. human body) and the way it reacts to external infections or invasive harmful agents (e.g. virus, bacteria, parasites). They focus their study on those diseases that affect the immunology of living organisms in order to classify them for treatment.",http://data.europa.eu/esco/isco/C2131,"Biologists, botanists, zoologists and related professionals"
Occupation,http://data.europa.eu/esco/occupation/b65133db-b3de-44d1-88fa-1d3deda08245,law lecturer,released,specialist law lecturer | lecturer in law | university lecturer in law | law docent | lecturer of law | law lector | university law teacher | law instructor | university law lecturer | higher education law teacher | senior lecturer in law | professor of law | law teacher | university law instructor | law professor,"Law lecturers are subject professors, teachers, or lecturers who instruct students who have obtained an upper secondary education diploma in their own specialised field of study, law, which is predominantly academic in nature. They work with their university research assistants and university teaching assistants for the preparation of lectures and of exams, for grading papers and exams and for leading review and feedback sessions for the students. They also conduct academic research in their respective field of law, publish their findings and liaise with other university colleagues.",http://data.europa.eu/esco/occupation/684fd8d5-9b40-4b02-a680-438f0082d923,higher education lecturer
Occupation,http://data.europa.eu/esco/occupation/b73c752b-9858-4f53-82de-f3a340cbcae9,epidemiologist,released,epidemiology science researcher | epidemiology researcher | epidemiology research analyst | epidemiology analyst | epidemiology research scientist | epidaemiologist | epidemiology scholar | epidemiology scientist,Epidemiologists centre their research on origin and causes for illness eruption in humans. They determine the way in which diseases are spread out and propose risk preventive measures to health policy organisms.,http://data.europa.eu/esco/occupation/eee68e13-8248-43bb-a9fb-959832a6c217,biologist
Occupation,http://data.europa.eu/esco/occupation/b79cfd33-6e46-4b71-b180-c9a84422f047,seismologist,released,seismologists | seismology research analyst | seismology analyst | seismology researcher | seismology scientist | seismology science researcher | seismology scholar | seismology research scientist,"Seismologists study the movement of tectonic plaques in the Earth which causes the propagation of seismic waves and earthquakes. They study and observe the various sources causing earthquakes such as volcanic activity, atmospheric phenomena, or the behaviour of oceans. They provide their scientific observations to prevent dangers in construction and infrastructure.",http://data.europa.eu/esco/occupation/c6196b21-20f9-4608-83fb-6f143afc740d,geologist
Occupation,http://data.europa.eu/esco/occupation/bac64fa2-dcd6-47bb-8e5c-04e04a86a199,geographer,released,economic geographer | geographers | biogeographer | cultural geographer | physical geographer | natural geographer | human geographer | geography research scientist,"Geographers are scholars who study human and physical geography. Depending on their specialisation, they study political, economical and cultural aspects of humanity contained within human geography. Moreover, they study land formations, soils, natural frontiers, and water flows contained in physical geography.",http://data.europa.eu/esco/isco/C2632,"Sociologists, anthropologists and related professionals"
Occupation,http://data.europa.eu/esco/occupation/bb609566-3ab6-44dd-8f48-cf0b15b96827,automation engineer,released,engineer in automation | electric vehicles automation engineer | automated systems engineer | manufacturing engineer in automation | mining automation engineer | agricultural automation engineer | unmanned vessel engineer | vessel autonomy engineer | automation systems engineer | battery and microgrids automation engineer | fleet autonomy system engineer | specialist in automation systems | automated systems specialist | engineer in automation systems | specialist in automated systems | engineer in automated systems,"Automation engineers research, design, and develop applications and systems for the automation of the production process. They implement technology and reduce, whenever applicable, human input to reach the full potential of industrial robotics. Automation engineers oversee the process and ensure all systems run safely and smoothly.",http://data.europa.eu/esco/occupation/d7380260-1386-4e36-98b5-8115ca4a3536,production engineer
Occupation,http://data.europa.eu/esco/occupation/bc659adc-f42c-4ef6-89fe-fd030033f446,cosmologist,released,evolutionary cosmologist | cosmology scientist | observational cosmologist | theoretical cosmologist | cosmology data scientist | cosmology research scientist,"Cosmologists focus on the study of the universe as a whole, which is made up by its origin, evolution and ultimate fate. They use tools and scientific instruments to observe and study other galaxies and astronomical objects such as stars, black holes, planets and other celestial bodies.",http://data.europa.eu/esco/isco/C2111,Physicists and astronomers
Occupation,http://data.europa.eu/esco/occupation/be3c021d-bd93-45a0-ad32-e8fa8e0d17ef,modern languages lecturer,released,university modern languages lecturer | instructor in modern languages | modern languages teacher | higher education modern languages teacher | modern languages instructor | university lecturer in modern languages | specialist lecturer in modern languages | modern languages professor | senior lecturer in modern languages | lecturer in modern languages | lecturer of modern languages | university modern languages teacher | professor of modern languages | modern languages lector | modern languages docent,"Modern languages lecturers are subject professors, teachers, or lecturers who instruct students who have obtained an upper secondary education diploma in their own specialised field of study, modern languages, which is predominantly academic in nature. They work with their university research assistants and university teaching assistants in the preparation of lectures and of exams, for grading papers and exams and for leading review and feedback sessions for the students. They also conduct academic research in their respective field of modern languages, publish their findings and liaise with other university colleagues.",http://data.europa.eu/esco/occupation/684fd8d5-9b40-4b02-a680-438f0082d923,higher education lecturer
